{
  "$schema": "http://json-schema.org/draft-07/schema#",
  "title": "Process Capability Row",
  "description": "One manufacturing process's spatial / kinematic / energetic / tolerance envelope at a point in time. The per-process half of the Manufacturing Capability Index (claude-skills#205). Consumed by an AI design agent before it commits geometry, and the empirical substrate Koop's Law (#204) fits its curve against.",
  "type": "object",
  "additionalProperties": false,
  "required": [
    "process",
    "display_name",
    "min_feature_mm",
    "max_envelope_mm",
    "tolerance_floor_mm",
    "states_of_matter",
    "as_of",
    "gateable_today",
    "source"
  ],
  "properties": {
    "process": {
      "type": "string",
      "pattern": "^[a-z0-9]+(-[a-z0-9]+)*$",
      "description": "Stable kebab-case id, e.g. 'cnc-wood-milling'."
    },
    "display_name": {"type": "string", "minLength": 1},
    "min_feature_mm": {
      "type": "number",
      "exclusiveMinimum": 0,
      "description": "Spatial floor: smallest reliably producible feature (e.g. min bit radius * 2)."
    },
    "max_envelope_mm": {
      "type": "object",
      "additionalProperties": false,
      "required": ["x", "y", "z"],
      "description": "Spatial ceiling: max work/build volume in mm.",
      "properties": {
        "x": {"type": "number", "exclusiveMinimum": 0},
        "y": {"type": "number", "exclusiveMinimum": 0},
        "z": {"type": "number", "minimum": 0}
      }
    },
    "kinematic_cadence": {
      "type": "object",
      "additionalProperties": false,
      "description": "Speed before deflection/warp. Aspirational under load; not gateable today (see README).",
      "properties": {
        "feed_mm_per_min": {"type": "number", "minimum": 0},
        "max_speed_before_deflection_mm_per_min": {"type": "number", "minimum": 0}
      }
    },
    "energetic_threshold_j_per_cm3": {
      "type": "number",
      "minimum": 0,
      "description": "Energy to alter/remove a unit volume in this process's dominant state of matter."
    },
    "tolerance_floor_mm": {
      "type": "number",
      "exclusiveMinimum": 0,
      "description": "Sigma-capability: tightest tolerance the process holds (+/- mm)."
    },
    "states_of_matter": {
      "type": "array",
      "minItems": 1,
      "items": {"type": "string", "enum": ["solid", "liquid", "gas", "plasma", "supercritical"]},
      "description": "States the process manipulates; gates the states-of-matter / thermodynamics challenge modifiers."
    },
    "as_of": {
      "type": "string",
      "pattern": "^[0-9]{4}(-Q[1-4]|-[0-9]{2})?$",
      "description": "Capability-timeline snapshot, e.g. '2026-Q3'. Rows are time-stamped because the index is a moving boundary."
    },
    "gateable_today": {
      "type": "boolean",
      "description": "True if a MakerBench seed can enforce this row's spatial/tolerance fields against a real grader today."
    },
    "source": {"type": "string", "minLength": 1, "description": "Provenance: vendor spec, measured run, or estimate."}
  }
}
